{
  "schema_version": "1.0.0",
  "context_pack_id": "context_pack_ws_productos_v2_bounded_baseline",
  "workspace_id": "ws_productos_v2",
  "request_summary": "Assemble the context needed to review the truthful control-surface slice before expanding the bounded baseline.",
  "decision_to_be_made": "Should ProductOS treat the current runtime bundle as trustworthy enough to score and promote release claims?",
  "status": "watch",
  "audience": [
    "PM",
    "engineering",
    "leadership"
  ],
  "mission_router": {
    "entry_phase": "discover",
    "phase_sequence": [
      "discover",
      "align",
      "operate",
      "improve"
    ],
    "primary_reviewer_lane": "pm_builder",
    "routing_rationale": "Start every next-version mission in discover, then expand only when the prior phase stays reviewable and evidence-backed.",
    "stop_conditions": [
      "Stop if evidence freshness or provenance becomes unclear.",
      "Stop if the current phase output is not PM-reviewable.",
      "Stop before downstream release movement unless PM approval is explicit."
    ]
  },
  "steering_context": {
    "steering_refs": [
      "tests/fixtures/workspaces/productos-sample/docs/planning/steering-context.md",
      "core/docs/vendor-neutral-agent-harness-standard.md",
      "core/docs/ralph-loop-model.md"
    ],
    "operating_norms": [
      "Treat the repository as the system of record.",
      "Keep PM approval explicit for decision-driving scope and release movement.",
      "Preserve observed versus inferred claims when evidence is incomplete.",
      "Prefer the smallest coherent slice that can be validated end to end."
    ],
    "memory_priority_order": [
      "decisions",
      "evidence",
      "prior_artifacts",
      "repeated_issues",
      "strategic_memory"
    ],
    "default_artifact_focus": [
      "mission_brief",
      "problem_brief",
      "concept_brief",
      "prd",
      "document_sync_state",
      "status_mail",
      "feature_portfolio_review"
    ]
  },
  "quality_contract": {
    "audience": [
      "PM",
      "engineering",
      "leadership"
    ],
    "decision_needed": "Decide whether the current runtime can score itself without additional provenance and eval hardening.",
    "evidence": [
      "The design review reports mixed seeded and generated provenance.",
      "The current CLI still reports all-green summaries."
    ],
    "alternatives": [
      "Hold release scoring until provenance is explicit",
      "Ship the bounded baseline with watch-level review gates"
    ],
    "recommendation": "Ship the bounded baseline, but keep truthfulness and eval regressions visible instead of claiming full promotion.",
    "metrics": [
      "regression_count",
      "mixed_provenance_feature_count"
    ],
    "risks": [
      "The system may still sound healthier than it is.",
      "Scoring can drift if evals are not frozen."
    ],
    "owner": "ProductOS PM",
    "next_action": "Run the frozen eval suite and route the failing slices into bounded fixes."
  },
  "evidence_bundle": [
    {
      "source_id": "feature_portfolio_review_ws_productos_v2_next_version_baseline",
      "source_type": "artifact",
      "summary": "The current portfolio review still reports all major slices as promoted.",
      "confidence": 0.91,
      "freshness_status": "fresh",
      "claim_mode": "direct_evidence"
    },
    {
      "source_id": "feedback_2026_03_23_design_and_architecture_review",
      "source_type": "feedback_note",
      "summary": "The architecture review says runtime truth, seeded fixtures, and self-scoring remain too tightly coupled.",
      "confidence": 0.94,
      "freshness_status": "fresh",
      "claim_mode": "direct_evidence"
    }
  ],
  "contradictions": [
    "CLI health is green while the review notes unresolved truthfulness gaps."
  ],
  "open_questions": [
    "Which feature should be rescored first once provenance is explicit?"
  ],
  "source_artifact_ids": [
    "feature_portfolio_review_ws_productos_v2_next_version_baseline",
    "validation_lane_report_next_version_completion"
  ],
  "recommended_next_action": "Treat the runtime as watch-level until eval and provenance signals become explicit inputs to scoring.",
  "created_at": "2026-03-26T08:00:00Z",
  "updated_at": "2026-03-26T08:00:00Z"
}
